{
    "schema_version":  "1.0",
    "envelope_id":  "CLINE-TASK-ENVELOPE-004-EXAMPLE-001",
    "task_id":  "TASK-CLINE-004-SMOKE-001",
    "project_id":  "ENGREMIAT-CONTROLLED-CLINE-WORKER-ADAPTER-004",
    "objective":  "Create a harmless evidence file proving one controlled Cline task boundary.",
    "instructions":  "Create only the declared evidence file. Do not access the network, do not modify other files, do not commit and do not continue automatically.",
    "repository_scope":  "data/engremiat-controlled-cline-worker-adapter-004",
    "allowed_paths":  [
                          "data/engremiat-controlled-cline-worker-adapter-004/step-004-05-controlled-cline-task-smoke"
                      ],
    "forbidden_actions":  [
                              "NETWORK_ACCESS",
                              "GIT_PUSH",
                              "GIT_FORCE",
                              "DELETE_OUTSIDE_ALLOWED_PATHS",
                              "FREE_FORM_SHELL",
                              "AUTOMATIC_CONTINUATION",
                              "MODIFY_CLINE_SESSION_METADATA"
                          ],
    "validation_contract":  [
                                "OUTPUT_FILE_EXISTS",
                                "OUTPUT_JSON_VALID",
                                "TASK_ID_MATCHES",
                                "NO_UNDECLARED_FILES",
                                "NO_GIT_WRITE"
                            ],
    "timeout_seconds":  300,
    "authorization_context":  {
                                  "task_authorization_state":  "AUTHORIZED",
                                  "execution_authorization_state":  "PENDING_EXECUTION_AUTHORIZATION"
                              },
    "execution_policy":  "SINGLE_TASK_CONTROLLED",
    "dry_run":  true,
    "runtime_execution":  false
}
